rating,waktu,text_clean,text_preprocessed
5,2022-06-09 12:23:55,aplikasi yang sangat bagus sangat membantu permasalahan kelistrikan dapat mengetahui area pemadaman pasang baru tambah data dan migrasi terima kasih pln,"['aplikasi', 'bagus', 'bantu', 'masalah', 'listrik', 'area', 'madam', 'pasang', 'data', 'migrasi', 'terima', 'kasih', 'pln']"
5,2022-06-09 12:18:00,mantap sangat membantu untuk mempermudah laporan pelayanan cepat dan baik terimakasih pln,"['mantap', 'bantu', 'mudah', 'lapor', 'layan', 'cepat', 'terimakasih', 'pln']"
5,2022-06-09 12:12:07,awalnya ribet setelah di pelajari ternyata banyak manfaatnya lebih mudah dalam pelaporan gangguan maupun tambah daya terimakasih pln,"['ribet', 'ajar', 'manfaat', 'mudah', 'lapor', 'ganggu', 'daya', 'terimakasih', 'pln']"
5,2022-06-09 12:10:56,aplikasi yang sangat bermanfaat mempermudah melihat saldo token lapor gangguan juga lebih mudah dan cepat,"['aplikasi', 'manfaat', 'mudah', 'saldo', 'token', 'lapor', 'ganggu', 'mudah', 'cepat']"
5,2022-06-09 12:08:39,banyak menu yg terus menerus diperbaharui yang sangat membantu dalam pemakaian listrik seharihari mantap,"['menu', 'yg', 'terus', 'baharu', 'bantu', 'pakai', 'listrik', 'seharihari', 'mantap']"
5,2022-06-09 12:05:15,aplikasi sangat bagus membantu sekali dalam hal membeli token dan pengaduan dari aplikasi sangat mudah dan cepat di tanggapi terimakasih pln mobile,"['aplikasi', 'bagus', 'bantu', 'beli', 'token', 'adu', 'aplikasi', 'mudah', 'cepat', 'tanggap', 'terimakasih', 'pln', 'mobile']"
1,2022-06-09 12:05:11,ribet mau pasang token listrik baru aja harus pake lso dan nidi dengan proses yang ini itulah dan kita harus menunggu sertifikat tersebut entah kapan dengan pembayaran terlebih dahuluinilah mending calo sekalian dengan nilai budget selisih tanpa harus ribet waktu,"['ribet', 'pasang', 'token', 'listrik', 'aja', 'pake', 'lso', 'nidi', 'proses', 'tunggu', 'sertifikat', 'bayar', 'dahuluinilah', 'mending', 'calo', 'nilai', 'budget', 'selisih', 'ribet']"
5,2022-06-09 12:04:26,aplikasi bagus sangat membantu untuk pembayar listrik lebih mudah respon cepat,"['aplikasi', 'bagus', 'bantu', 'bayar', 'listrik', 'mudah', 'respon', 'cepat']"
5,2022-06-09 11:57:47,aplikasi sangat membantu bisa tau info pemadaman tagihanpasang baru migrasi dan tambah daya bisa pengaduan menghemat waktu tanpa harus datang ke kantor pln,"['aplikasi', 'bantu', 'tau', 'info', 'madam', 'tagihanpasang', 'migrasi', 'daya', 'adu', 'hemat', 'kantor', 'pln']"
5,2022-06-09 11:57:46,aplikasi sangat membantu bisa dpt info pemadaman tagihan pasang baru dan tambah daya tanpa datang ke kantor pln,"['aplikasi', 'bantu', 'dpt', 'info', 'madam', 'tagih', 'pasang', 'daya', 'kantor', 'pln']"
5,2022-06-09 11:54:44,aplikasinya sudah bagus sekarang sudah ada fitur belanja juga jadi sekarang sudah komplit bisa bersaing sekarang semoga fiturnya terus bertambah,"['aplikasi', 'bagus', 'fitur', 'belanja', 'komplit', 'saing', 'moga', 'fiturnya', 'tambah']"
5,2022-06-09 11:48:13,sangat bermanfaat dengan adanya pln mobilemengetahui info tentang pln lebih mudah dan pengisian pulsa token juga lebih praktis,"['manfaat', 'pln', 'mobilemengetahui', 'info', 'pln', 'mudah', 'isi', 'pulsa', 'token', 'praktis']"
5,2022-06-09 11:44:44,simple  mudahsemua nya semakin mudah dengan  aplikasi untuk semua transaksipln mobile,"['simple', 'mudahsemua', 'nya', 'mudah', 'aplikasi', 'transaksipln', 'mobile']"
1,2022-06-09 11:38:25,aplikasi eror tidak bermutu pelayanan tidak sesuai dengan jadwal yang telah ditentukan saya sudah melakukan pembayaran dari tanggal  mei  tapi sampai sekarang belum ada tanggapan katanya  hari kerja ini sudah  bulan belum ada respon aplikasi apaan kaya ini aplikasi tidak bermutu uangnya memang tidak seberapa apa ini aplikasi abal  abal ada yang mendaftar ke agen langsung di pasang ini sudah melalui aplikasi pln mobile,"['aplikasi', 'eror', 'mutu', 'layan', 'sesuai', 'jadwal', 'tentu', 'bayar', 'tanggal', 'mei', 'tanggap', 'kerja', 'respon', 'aplikasi', 'kaya', 'aplikasi', 'mutu', 'uang', 'aplikasi', 'abal', 'abal', 'daftar', 'agen', 'langsung', 'pasang', 'aplikasi', 'pln', 'mobile']"
1,2022-06-09 11:31:11,tidak ada tindakan lanjut terkait pemasangan iconnet diwilayah saya memang tidak tercover tapi sudah lewat beberapa bulan tidak ada pemberitahuan lebih lanjut kecewa,"['tindak', 'kait', 'pasang', 'iconnet', 'wilayah', 'tercover', 'pemberitahuan', 'kecewa']"
5,2022-06-09 11:24:35,dengan aplikasi plnmobile menjadi lebih mudahpraktis dan efisien semoga ke depan lebih canggih lagi,"['aplikasi', 'plnmobile', 'mudahpraktis', 'efisien', 'moga', 'canggih']"
5,2022-06-09 11:23:21,sangat membantu utk layanan kelistrikan mudah dan efisien dari sisi biaya semua makin mudah,"['bantu', 'utk', 'layan', 'listrik', 'mudah', 'efisien', 'sisi', 'biaya', 'mudah']"
5,2022-06-09 11:07:17,aplikasi yg sangat membatu sekali laporan gangguan cepat direspon tdk sampai  jam sdh ditangani dgn baik pembelian token tanpa biaya adminsemoga aplikasinya dpt berkembang lagi dgn fitur yg lainnya,"['aplikasi', 'yg', 'batu', 'lapor', 'ganggu', 'cepat', 'direspon', 'tdk', 'jam', 'sdh', 'tangan', 'dgn', 'beli', 'token', 'biaya', 'adminsemoga', 'aplikasi', 'dpt', 'kembang', 'dgn', 'fitur', 'yg']"
1,2022-06-09 10:52:11,saya heran sudah dftar dan saya sudah bayar sudah trhubung juga melalui wa tetapi tidak ad respon yg pasti kapan pemasangan jaringannyaheran,"['heran', 'dftar', 'bayar', 'trhubung', 'wa', 'ad', 'respon', 'yg', 'pasang', 'jaringannyaheran']"
5,2022-06-09 10:34:31,sangat terbantu dengan aplikasi ini semoga ke depan bisa jauh lebih baik dengan fitur andalan,"['bantu', 'aplikasi', 'moga', 'fitur', 'andal']"
5,2022-06-09 10:32:44,dapat tersajikan dengan baik info tagihan listrik bulanannya jadi tahu naik turunnya pemakaian listrik bahkan ketika mencatatkan angka stand meternya juga sesuai dengan yang dituliskan,"['saji', 'info', 'tagih', 'listrik', 'bulan', 'turun', 'pakai', 'listrik', 'catat', 'angka', 'stand', 'meter', 'sesuai', 'tulis']"
1,2022-06-09 10:25:32,ada yang merasa pasang inconet token listrik jadi cepat habis jika internetnya di pakai banyak user sering buka youtube di tv sya eksperiman nibiasa token kperbulan sblm pasang iconet skrg jdi k setelah pasang iconet degan pemakaian internet jam untuk buka youtube di tv token k cuma bertahan hari skrg anak istri sya sdng mudik internet jrng di pakai token k bisa bertahan mingguan jdi merasa rugi ya udh bayar bulanan  token listrik jdi besar,"['pasang', 'inconet', 'token', 'listrik', 'cepat', 'habis', 'internetnya', 'pakai', 'user', 'buka', 'youtube', 'tv', 'sya', 'eksperiman', 'nibiasa', 'token', 'kperbulan', 'sblm', 'pasang', 'iconet', 'skrg', 'jdi', 'k', 'pasang', 'iconet', 'degan', 'pakai', 'internet', 'jam', 'buka', 'youtube', 'tv', 'token', 'k', 'tahan', 'skrg', 'anak', 'istri', 'sya', 'sdng', 'mudik', 'internet', 'jrng', 'pakai', 'token', 'k', 'tahan', 'minggu', 'jdi', 'rugi', 'ya', 'udh', 'bayar', 'bulan', 'token', 'listrik', 'jdi']"
4,2022-06-09 07:15:31,daftar instalatir resmi tidak muncul bs jadi celah untuk korupsi dan kolusi ternyata customer service ok banget menerangkan dengan detail sayang upgrade akun saya terkendala karena beda nama di ktp,"['daftar', 'instalatir', 'resmi', 'muncul', 'bs', 'celah', 'korupsi', 'kolusi', 'customer', 'service', 'ok', 'banget', 'terang', 'detail', 'sayang', 'upgrade', 'akun', 'kendala', 'beda', 'nama', 'ktp']"
5,2022-06-08 22:28:59,aplikasi sangat membantu peanganan di lapangan sangat cepat dan tanggap  terimkasih kepada pekerja lapangan lapangan,"['aplikasi', 'bantu', 'peanganan', 'lapang', 'cepat', 'tanggap', 'terimkasih', 'kerja', 'lapang', 'lapang']"
1,2022-06-08 21:55:27,ini kenapa abis di update gak bisa melihat data tagihan malah tidak membantu sama sekali bintang  klo gitu,"['abis', 'update', 'gak', 'data', 'tagih', 'bantu', 'bintang', 'klo', 'gitu']"
5,2022-06-08 21:00:06,aplikasi pln sg kenapa error mulu ya sdh di update malah tambah error padahal enak beli token listrik di aplikasi pln ini mudah gak ribet tolong diperbaiki lagi aplikasi nya ya,"['aplikasi', 'pln', 'sg', 'error', 'mulu', 'ya', 'sdh', 'update', 'error', 'enak', 'beli', 'token', 'listrik', 'aplikasi', 'pln', 'mudah', 'gak', 'ribet', 'tolong', 'baik', 'aplikasi', 'nya', 'ya']"
1,2022-06-08 16:23:45,aplikasi sangat tidak berguna tidak ada fungsinya buat apa coba aplikasi burik ini jangan di download nanti nyesel aplikasi nggak bergunaaaa,"['aplikasi', 'guna', 'fungsi', 'coba', 'aplikasi', 'burik', 'download', 'nyesel', 'aplikasi', 'nggak', 'bergunaaaa']"
5,2022-06-08 15:42:40,aplikasi sudah semakin baik cuman atau disayangkan info pelayanan listrik via notifikasi selalu telat tidak realtime dgn kejadian masalah listrik pada saat itu jadi pelanggan slalu bertanyatanya kenapa padam listrik terlalu lama diatas standarnya lebih dari  jam biayanya pemadaman bergilir cuman  jam,"['aplikasi', 'cuman', 'sayang', 'info', 'layan', 'listrik', 'via', 'notifikasi', 'telat', 'realtime', 'dgn', 'jadi', 'listrik', 'langgan', 'slalu', 'bertanyatanya', 'padam', 'listrik', 'atas', 'standar', 'jam', 'biaya', 'madam', 'gilir', 'cuman', 'jam']"
1,2022-06-08 14:01:24,aplikasi gak guna gak ada faedahnyas sama sekali beli token  hari baru keluar no vouchernya aplikasi cuma buat makan uang negara aja,"['aplikasi', 'gak', 'gak', 'faedahnyas', 'beli', 'token', 'no', 'vouchernya', 'aplikasi', 'makan', 'uang', 'negara', 'aja']"
1,2022-06-08 13:54:23,mantap betul pembayaran sudah lunas sejak  april lalu untuk berlangganan iconnet sampai saat ini belum ada pemasangan sudah komplen tapi jawabannya selalu diminta untuk menunggu,"['mantap', 'bayar', 'lunas', 'april', 'langgan', 'iconnet', 'pasang', 'komplen', 'jawab', 'tunggu']"
3,2022-06-08 13:34:06,kenapa di aplikasi pln jaringan iconnet sudah tercover lalu saya melakukan registrasi tapi besoknya saya di wa katanya jaringan iconet dalam tahap pembangunan di wilayah anda kapan tahap pembangunan itu selesai,"['aplikasi', 'pln', 'jaring', 'iconnet', 'tercover', 'registrasi', 'besok', 'wa', 'jaring', 'iconet', 'tahap', 'bangun', 'wilayah', 'tahap', 'bangun', 'selesai']"
3,2022-06-08 13:26:46,bintang  karna  yang pertama  saya tidak bisa cek sisa token di rumah via apl inikarna rumah saya jauh dan jarang di tempati pernah smp kehabisan dalam waktu lama dn terblokir ke dua  token listrik yang gagal di masukan karna meteran listrik rusaktidak ada penggantian padahal sudah tanyakan ke petugas tp tidak ada tidak lanjut apa lagi penggantian terima kasih,"['bintang', 'karna', 'cek', 'sisa', 'token', 'rumah', 'via', 'apl', 'inikarna', 'rumah', 'jarang', 'tempat', 'smp', 'habis', 'dn', 'blokir', 'token', 'listrik', 'gagal', 'masuk', 'karna', 'meter', 'listrik', 'rusaktidak', 'ganti', 'tugas', 'tp', 'ganti', 'terima', 'kasih']"
5,2022-06-08 13:25:47,maaf min aplikasi pln mobile nya ada masalah lagi tidak dapat bayar menggunakan linkaja selalu terjadi error tolong perbaikannya,"['maaf', 'min', 'aplikasi', 'pln', 'mobile', 'nya', 'bayar', 'linkaja', 'error', 'tolong', 'baik']"
5,2022-06-08 13:13:24,aplikasi yang sangat bagus dikarenakan  kali saya menggunakan untuk laporan pengaduan kedua laporan saya teratasi mohon tetap konsisten dalam pelayanan terima kasih,"['aplikasi', 'bagus', 'kali', 'lapor', 'adu', 'lapor', 'atas', 'mohon', 'konsisten', 'layan', 'terima', 'kasih']"
1,2022-06-08 13:12:40,aplikasi error aplikasi nya sakit sudah melakukan pendaftaran iconnet dari tgl  mei  dan telah melakukan pembayaran tapi sampai saat ini belum ada konfirmasi mengenai pemasangan anehnya pada aplikasi meminta melakukan pembayaran tagihan sdah melakukan konfirmasi wa dari cc tapi tdak ada balasan dan melakukan telp ke cc tanggapan nya hanya disuruh menunggu yg tidak pasti,"['aplikasi', 'error', 'aplikasi', 'nya', 'sakit', 'daftar', 'iconnet', 'tgl', 'mei', 'bayar', 'konfirmasi', 'pasang', 'aneh', 'aplikasi', 'bayar', 'tagih', 'sdah', 'konfirmasi', 'wa', 'cc', 'tdak', 'balas', 'telp', 'cc', 'tanggap', 'nya', 'suruh', 'tunggu', 'yg']"
5,2022-06-08 11:44:44,aplikasi sangat membantu dalam pembayaran pln dan untuk mengecek sisa token hanya untuk pengaduan jika mengalami kendala itu lama prosesnya trimakasih,"['aplikasi', 'bantu', 'bayar', 'pln', 'ecek', 'sisa', 'token', 'adu', 'alami', 'kendala', 'proses', 'trimakasih']"
3,2022-06-08 11:33:24,untuk upload foto kamera depan pasti ngeblur udah ganti hp yang lain yang lebih bagus hasil nya tetap sama padahal kamera depan untuk digunakan foto biasa hasilnya sangat bagus tapi untuk apps ini hasilnya jadi tidak bagus,"['upload', 'foto', 'kamera', 'ngeblur', 'udah', 'ganti', 'hp', 'bagus', 'hasil', 'nya', 'kamera', 'foto', 'hasil', 'bagus', 'apps', 'hasil', 'bagus']"
5,2022-06-08 11:30:16,gk pernah kecewa sama apk ini bagus banget sangat membantu pengaduan selalu cepat di respon serta petugas yg ramah,"['gk', 'kecewa', 'apk', 'bagus', 'banget', 'bantu', 'adu', 'cepat', 'respon', 'tugas', 'yg', 'ramah']"
1,2022-06-08 10:27:29,sudah melakukan pembayaran tidak ada pemasangan internet katanya bok penuh sampai sekarang tidak ada solusi pengembalian dana atau pemasangan internet melakukan chat melalui whatapp dan facebook tetap tidak mendapatkan solusinya setelah di app pln mobile di update riwayat pembayaran kita hilang bagaimana,"['bayar', 'pasang', 'internet', 'bok', 'penuh', 'solusi', 'kembali', 'dana', 'pasang', 'internet', 'chat', 'whatapp', 'facebook', 'solusi', 'app', 'pln', 'mobile', 'update', 'riwayat', 'bayar', 'hilang']"
1,2022-06-08 10:08:51,aplikasi taik kalau ada kendala tidak ada yang bisa dihubungin telp cs lewat email masih aja tidak ada respon,"['aplikasi', 'taik', 'kendala', 'dihubungin', 'telp', 'cs', 'email', 'aja', 'respon']"
5,2022-06-08 09:18:24,aaplikasi nya sering ngadat lagi live chat tiba gak bisa respon ngetik aja gak bisa ampuuun dah ni aplikasi diatas adalah respon saya utk aplikasi ini sebelumnya namun respon yg diberikan pln cepat terimakash utk pelayanan nya mohon utk ditingkatkan kembali,"['aaplikasi', 'nya', 'ngadat', 'live', 'chat', 'gak', 'respon', 'ngetik', 'aja', 'gak', 'ampuuun', 'dah', 'ni', 'aplikasi', 'atas', 'respon', 'utk', 'aplikasi', 'respon', 'yg', 'pln', 'cepat', 'terimakash', 'utk', 'layan', 'nya', 'mohon', 'utk', 'tingkat']"
5,2022-06-08 08:27:45,gimana sih pak wifi belom di pasang di rumah kok sudah suruh bayar lagi biaya bulanan nya bikin aplikasi kayak mainan anak kecil aja,"['gimana', 'sih', 'wifi', 'bom', 'pasang', 'rumah', 'suruh', 'bayar', 'biaya', 'bulan', 'nya', 'bikin', 'aplikasi', 'kayak', 'main', 'anak', 'aja']"
5,2022-06-08 08:12:56,cukup membantu kalo adamasalah pasang baru dan tambah daya serta pengaduan gangguansudah saya buktikan sendiri,"['bantu', 'kalo', 'adamasalah', 'pasang', 'daya', 'adu', 'gangguansudah', 'bukti']"
1,2022-06-08 06:28:44,tidak sesuai harapan dan masih banyak alasan petugas lapangan dengan alasan nambah biaya tarik kabel yang lumayan jauh padahal instalasi paralel ada yang dekat dengan rumah biar bisa dapat uang,"['sesuai', 'harap', 'alas', 'tugas', 'lapang', 'alas', 'nambah', 'biaya', 'tarik', 'kabel', 'lumayan', 'instalasi', 'paralel', 'rumah', 'biar', 'uang']"
1,2022-06-08 00:58:50,cs nya lambat dalam membalas pesan suruh belajar baca dulu cs nya terus ilmunya di tambah lagi pakai yang benarbenar tau masalah listrik saya rasa masih banyak cs yg lbh pintar di luar sana,"['cs', 'nya', 'lambat', 'balas', 'pesan', 'suruh', 'ajar', 'baca', 'cs', 'nya', 'ilmu', 'pakai', 'benarbenar', 'tau', 'listrik', 'cs', 'yg', 'lbh', 'pintar']"
5,2022-06-07 22:43:45,dengan adanya aplikasi ini sangat sangat membantu sekali dlm setiap ada masalah sdh pake aplikasi ini semua ditangani dg cpt keren trima kasi pln,"['aplikasi', 'bantu', 'dlm', 'sdh', 'pake', 'aplikasi', 'tangan', 'dg', 'cpt', 'keren', 'trima', 'kasi', 'pln']"
1,2022-06-07 22:17:53,gak membantu saya download supaya mempermudah info tagihan malah sebaliknya gak ada info sama sekali ini jamannya komputerisasi harusnya sistem informasinya jelas dan mudah diakses next harus lebih baik auto uninstal,"['gak', 'bantu', 'download', 'mudah', 'info', 'tagih', 'gak', 'info', 'jaman', 'komputerisasi', 'sistem', 'informasi', 'mudah', 'akses', 'next', 'auto', 'uninstal']"
5,2022-06-07 21:52:41,cukup baik  membantu mungkin bila di tambah lagi untuk dompet digital pembayaran melalui dana supaya lebih lengkap  memudahkan pelanggan,"['bantu', 'dompet', 'digital', 'bayar', 'dana', 'lengkap', 'mudah', 'langgan']"
5,2022-06-07 21:40:10,suatu aplikasi yang memudahkan pelanggan dan calon pelanggan untuk melakukan berbagai aktifitas transaksi yang berhubungan dengan kebutuhan akan listrik yang saat ini sudah menjadi kebutuhan primer dalam kehidupan masyarakat yang lebih baik dengan menggunakan pln mobile saya merasa sangan tetbantu dan memperoleh layanan cepat handal dan amazing pln mantab,"['aplikasi', 'mudah', 'langgan', 'calon', 'langgan', 'aktifitas', 'transaksi', 'hubung', 'butuh', 'listrik', 'butuh', 'primer', 'hidup', 'masyarakat', 'pln', 'mobile', 'sangan', 'tetbantu', 'oleh', 'layan', 'cepat', 'handal', 'amazing', 'pln', 'mantab']"
4,2022-06-07 20:28:50,update sekarang tambah bintang  jadi  bintang pelayanan cs nyaman dan cepat tanggap terimakasih pln  dulu posting ini  bintang satu pelayanan customer service by online tidak cepat meski jaringan penuh skrg bintang   trma kasih mantap perubahannya pln,"['update', 'bintang', 'bintang', 'layan', 'cs', 'nyaman', 'cepat', 'tanggap', 'terimakasih', 'pln', 'posting', 'bintang', 'layan', 'customer', 'service', 'by', 'online', 'cepat', 'jaring', 'penuh', 'skrg', 'bintang', 'trma', 'kasih', 'mantap', 'ubah', 'pln']"
5,2022-06-07 20:26:19,sangat membatu sekali terimakasih untuk aplikasi ini layanan cepat sekali dan sangat membatu sekali dan pihak pln nya sangat merespon dengan cepat,"['batu', 'terimakasih', 'aplikasi', 'layan', 'cepat', 'batu', 'pln', 'nya', 'merespon', 'cepat']"
3,2022-06-07 19:38:27,sebetulnya aplikasi ini bagus  pln mobile  mhon untuk pengajuan pasang baru lewat pln mobile juga diperlancar  jangan buat aplikasi ini sebagai formalitas saja  pak erik tohir bumn kok kaya gini,"['aplikasi', 'bagus', 'pln', 'mobile', 'mhon', 'aju', 'pasang', 'pln', 'mobile', 'lancar', 'aplikasi', 'formalitas', 'erik', 'tohir', 'bumn', 'kaya', 'gin']"
1,2022-06-07 19:15:54,ribet mau pasang baru aja dibikin puyeng harus ada slo dulu suruh download siujang gatrik udah download jasa pemasangan nya tidak bisa menjankau alasan kejauhan tolong diperbaiki alur untuk pemasangan baru saya mah orang kampung mana tau aplikasi ini itu,"['ribet', 'pasang', 'aja', 'bikin', 'puyeng', 'slo', 'suruh', 'download', 'siujang', 'gatrik', 'udah', 'download', 'jasa', 'pasang', 'nya', 'menjankau', 'alas', 'jauh', 'tolong', 'baik', 'alur', 'pasang', 'mah', 'orang', 'kampung', 'tau', 'aplikasi']"
2,2022-06-07 18:56:59,mau tambah saya harus upgrade akun sudah di upgrade masih tetep ga bisa hh coba klo di web bisa ga bakaln kaya gini ribet ternyataaplikasi pln mobile paling sering minta updatepinter emang pln sayang cuma ada  pln d indonesia coba ada  pln,"['upgrade', 'akun', 'upgrade', 'tetep', 'ga', 'hh', 'coba', 'klo', 'web', 'ga', 'bakaln', 'kaya', 'gin', 'ribet', 'ternyataaplikasi', 'pln', 'mobile', 'updatepinter', 'emang', 'pln', 'sayang', 'pln', 'd', 'indonesia', 'coba', 'pln']"
5,2022-06-07 15:34:07,aplikasi yang sangat membantu jadi lebih mudah untuk ngecek beli token dan pengaduan pln terbaik,"['aplikasi', 'bantu', 'mudah', 'ngecek', 'beli', 'token', 'adu', 'pln', 'baik']"
5,2022-06-07 15:01:44,aplikasi pln mobile sangat mengerti dengan kebutuhan pelanggan saat ini karena semua cukup dengan satu jari semua beresresres,"['aplikasi', 'pln', 'mobile', 'erti', 'butuh', 'langgan', 'jari', 'beresresres']"
1,2022-06-07 14:55:43,marketplace servernya pelan bgt pesanan dri tgl  mei belum dikirim tp tidak bisa dibatalkan  pembatalan otomatis chat ke penjualpun belum ada menunya,"['marketplace', 'servernya', 'pelan', 'bgt', 'pesan', 'dri', 'tgl', 'mei', 'kirim', 'tp', 'batal', 'batal', 'otomatis', 'chat', 'jual', 'menu']"
1,2022-06-07 14:50:07,pelayanan mengecewakan saya mengajukan pengembalian dana karena permohonan dibatalkan alasan jaringan pln sudah  tahun belum ada realisasi tolonglah segera dikembalikan uang saya yang jumlahnya tidak sedikit,"['layan', 'kecewa', 'aju', 'kembali', 'dana', 'mohon', 'batal', 'alas', 'jaring', 'pln', 'realisasi', 'tolong', 'kembali', 'uang']"
5,2022-06-07 13:34:25,aplikasi sangat membantu kita saat top up token listrik prabayar dan juga bagi pasca bayar bisa melihat tagihan secara langsung aplikasi sangat berguna,"['aplikasi', 'bantu', 'top', 'up', 'token', 'listrik', 'prabayar', 'pasca', 'bayar', 'tagih', 'langsung', 'aplikasi', 'guna']"
1,2022-06-07 13:09:48,terlalu banyak verifikasi  versi sebelum nya udah enak ga banyak yang harus di verifikasi kadang loading nya pun lama dan gagal terhubung ke servernya,"['verifikasi', 'versi', 'nya', 'udah', 'enak', 'ga', 'verifikasi', 'kadang', 'loading', 'nya', 'gagal', 'hubung', 'servernya']"
5,2022-06-07 13:08:55,aplikasinya sangat mempermudah untuk pelaporan gangguan ataupun keluhan dan bisa pengajuan permohonan tambah daya serta dapat membaca kwh meter secara mandiri jaya terus pln semangat yak dalam bekerjanyaa,"['aplikasi', 'mudah', 'lapor', 'ganggu', 'keluh', 'aju', 'mohon', 'daya', 'baca', 'kwh', 'meter', 'mandiri', 'jaya', 'pln', 'semangat', 'yak', 'bekerjanyaa']"
5,2022-06-07 12:47:47,download aplikasi ini karena ada pengaduan di menu kebetulan listrik di rumah bermasalah dan ternyata respon nya cepat setelah di kasih arahan dan gak bisa juga akhirnya di samperin  personil pln saga cisoka tangerang banten yang gercep dan profesional dan akhirnya beres mantap  dan terimakasih,"['download', 'aplikasi', 'adu', 'menu', 'listrik', 'rumah', 'masalah', 'respon', 'nya', 'cepat', 'kasih', 'arah', 'gak', 'samperin', 'personil', 'pln', 'saga', 'cisoka', 'tangerang', 'banten', 'gercep', 'profesional', 'beres', 'mantap', 'terimakasih']"
5,2022-06-07 12:30:47,penggunaannya mudah info terkait pemadaman serta tagihan listrik juga bisa termonitor mau isi pulsa listrik juga jadi gampang,"['guna', 'mudah', 'info', 'kait', 'madam', 'tagih', 'listrik', 'monitor', 'isi', 'pulsa', 'listrik', 'gampang']"
5,2022-06-07 12:28:20,saya suka menggunakan pln mobile lebih akurat waktu baca meter setiap bulan dan prediksi jumlah tagihan setiap bisa langsung kelihatan,"['suka', 'pln', 'mobile', 'akurat', 'baca', 'meter', 'prediksi', 'tagih', 'langsung']"
1,2022-06-07 12:27:04,mengecewakan  status udah bayar iconet tp juga gak ada respon kapan instalasi nya  mau komplain juga susah email  ataupun live chat nya  payah bgt,"['kecewa', 'status', 'udah', 'bayar', 'iconet', 'tp', 'gak', 'respon', 'instalasi', 'nya', 'komplain', 'susah', 'email', 'live', 'chat', 'nya', 'payah', 'bgt']"
5,2022-06-07 11:48:38,membantu laporan gangguan dan notifikasi status gangguan makin mantab kita tahu waktu mulai dan sls gangguan listrik d rumah josss keren buat pln semoga makin kaya fitur,"['bantu', 'lapor', 'ganggu', 'notifikasi', 'status', 'ganggu', 'mantab', 'sls', 'ganggu', 'listrik', 'd', 'rumah', 'josss', 'keren', 'pln', 'moga', 'kaya', 'fitur']"
5,2022-06-07 11:08:37,alhamdulillaah  aplikasinya mantab sangat membantu utk beli token dan bayar tagihan pln terbaik,"['alhamdulillaah', 'aplikasi', 'mantab', 'bantu', 'utk', 'beli', 'token', 'bayar', 'tagih', 'pln', 'baik']"
3,2022-06-07 10:57:17,edited done cuman fitur chat nya gaje ga bisa nulis tapi call nya oke fast respon  aja yak,"['edited', 'done', 'cuman', 'fitur', 'chat', 'nya', 'gaje', 'ga', 'nulis', 'call', 'nya', 'oke', 'fast', 'respon', 'aja', 'yak']"
5,2022-06-07 10:33:59,notifikasi pemberitahuan gangguan padam maupun status terkini sudah update,"['notifikasi', 'pemberitahuan', 'ganggu', 'padam', 'status', 'kini', 'update']"
4,2022-06-07 08:53:24,kenapa app nya error mau melakukan pengadun ketika upload photo dari kamera hp langsung selalu kembali ke menu utama jadi gagal terus pengaduannya mohon di perbaiki karena ini penting app ga guna udh email ke developer nya sudah di ikutin panduanya memory udh dikosongin dan jaringan jg kuat masih ga ada perubahan mendingan dihapus aja app nya ga guna kalau ujungujungannya harus tlp,"['app', 'nya', 'error', 'adun', 'upload', 'photo', 'kamera', 'hp', 'langsung', 'menu', 'utama', 'gagal', 'adu', 'mohon', 'baik', 'app', 'ga', 'udh', 'email', 'developer', 'nya', 'ikutin', 'panduanya', 'memory', 'udh', 'dikosongin', 'jaring', 'jg', 'kuat', 'ga', 'ubah', 'mending', 'hapus', 'aja', 'app', 'nya', 'ga', 'ujungujungannya', 'tlp']"
4,2022-06-07 08:48:51,tolong dong untuk transaksi cek pemasangan baru dll cukup cari dengan mencantumkan no ktp aja jangan pake nomor agenda kode booking dll biar lebih transparan dan bisa cek mandiri oleh pelanggan untuk mengetahui status prosesnya sudah sampai dimanaiya betul pak maksud saya nomor agenda itu cukup di ganti dengan no ktp aj pak jd kalo tidak ada no agendanya bisa digantikan dgn no ktp pakterima kasih,"['tolong', 'transaksi', 'cek', 'pasang', 'dll', 'cari', 'cantum', 'no', 'ktp', 'aja', 'pake', 'nomor', 'agenda', 'kode', 'booking', 'dll', 'biar', 'transparan', 'cek', 'mandiri', 'langgan', 'status', 'proses', 'dimanaiya', 'maksud', 'nomor', 'agenda', 'ganti', 'no', 'ktp', 'aj', 'jd', 'kalo', 'no', 'agenda', 'ganti', 'dgn', 'no', 'ktp', 'pakterima', 'kasih']"
5,2022-06-07 08:04:50,aplikasinya sangat membantu  memudahkan membeli token info pemadaman dll  semoga kedepannya semakin ditingkatkan lagi,"['aplikasi', 'bantu', 'mudah', 'beli', 'token', 'info', 'madam', 'dll', 'moga', 'depan', 'tingkat']"
1,2022-06-07 07:50:16,proses transaksi tidak berjalan padahal sudah transfer tp status msh menunggu pembayaran tolong dibantu untuk diatasi,"['proses', 'transaksi', 'jalan', 'transfer', 'tp', 'status', 'msh', 'tunggu', 'bayar', 'tolong', 'bantu', 'atas']"
