rating,waktu,text_clean,text_preprocessed
2,2022-06-02 22:29:18,aplikasinya masih banyak yang kosong layanannya saya kecewa beli token melalui aplikasi ini niat hati lebih hemat rp ternyata prosesnya tidak cepat saya membayar tagihan beli token dengan bcava setelah menit sejak berhasil bayar tagihan namun dalam riwayat transaksi masih dalam status menunggu pembayaran,"['aplikasi', 'kosong', 'layan', 'kecewa', 'beli', 'token', 'aplikasi', 'niat', 'hati', 'hemat', 'rp', 'proses', 'cepat', 'bayar', 'tagih', 'beli', 'token', 'bcava', 'menit', 'hasil', 'bayar', 'tagih', 'riwayat', 'transaksi', 'status', 'tunggu', 'bayar']"
4,2022-06-02 22:16:45,ditingkatkan lg aplikasinya saya melakukan live chat dg cs menunggu lama sekali dan sudah dpt antrian malah tidak bisa mengetik karena pada saat mau ngetik gak ada keyboard muncul,"['tingkat', 'lg', 'aplikasi', 'live', 'chat', 'dg', 'cs', 'tunggu', 'dpt', 'antri', 'etik', 'ngetik', 'gak', 'keyboard', 'muncul']"
1,2022-06-02 21:34:43,aplikasinya gak berguna untuk bagian pengaduan selalu x laporan via pln mobile listrik masih mati padahal udah  jam menunggu  giliran ditlp langsung baru gerak cepat percuma suruh download aplikasi kl ujungnya masih kudu tlp juga lagian aneh diaplikasi kl laporan listrik padam responnya lama banget sekalinya direspon bilang udah nyala padahal masih mati gak sinkron banget antara kenyataan lapangan sama keterangan diaplikasi pln mobile,"['aplikasi', 'gak', 'guna', 'adu', 'x', 'lapor', 'via', 'pln', 'mobile', 'listrik', 'mati', 'udah', 'jam', 'tunggu', 'gilir', 'ditlp', 'langsung', 'gerak', 'cepat', 'suruh', 'download', 'aplikasi', 'kl', 'ujung', 'kudu', 'tlp', 'aneh', 'aplikasi', 'kl', 'lapor', 'listrik', 'padam', 'responnya', 'banget', 'sekali', 'direspon', 'bilang', 'udah', 'nyala', 'mati', 'gak', 'sinkron', 'banget', 'nyata', 'lapang', 'terang', 'aplikasi', 'pln', 'mobile']"
5,2022-06-02 21:28:46,dengan pln mobile mau lapor catat meter permohonan pasang baru dan tambah daya ato pengaduan gangguan jadi lbh cepat dan mudah,"['pln', 'mobile', 'lapor', 'catat', 'meter', 'mohon', 'pasang', 'daya', 'ato', 'adu', 'ganggu', 'lbh', 'cepat', 'mudah']"
5,2022-06-02 21:22:52,aplikasi ini sangat membantu sekali bisa untuk lapor gangguan cek status laporan gangguan daftar pasang baru tambah daya migrasi dari pasca bayar ke prabayar dan lain sebagainya,"['aplikasi', 'bantu', 'lapor', 'ganggu', 'cek', 'status', 'lapor', 'ganggu', 'daftar', 'pasang', 'daya', 'migrasi', 'pasca', 'bayar', 'prabayar']"
1,2022-06-02 20:56:49,untuk tagihan listrik ny kok sering error yaawal awal bayar enaktapi bulan berikut ny sering errormohon segera di perbaiki,"['tagih', 'listrik', 'ny', 'error', 'yaawal', 'bayar', 'enaktapi', 'ny', 'errormohon', 'baik']"
1,2022-06-02 19:30:21,proses transaksinya lama padahal sudah transfer tapi status masih menunggu pembayaran terus layanan pengaduan lewat chat tidak berfungsi lewat telepon dikenai pulsa yang lumayan besar status berhasil di aplikasi baru muncul setelah memasukkan tokennya jelek banget diperbarui lagi fiturnya lah,"['proses', 'transaksi', 'transfer', 'status', 'tunggu', 'bayar', 'layan', 'adu', 'chat', 'fungsi', 'telepon', 'kena', 'pulsa', 'lumayan', 'status', 'hasil', 'aplikasi', 'muncul', 'masuk', 'tokennya', 'jelek', 'banget', 'baru', 'fiturnya']"
4,2022-06-02 17:20:48,aplikasi sdh bagus  kekurangan nya tdk bisa update data pelanggan saya tidak bisa mengecek tagihan icconet karena saat daftar icconet tidak melalui aplikasi pln mobile semoga kedepan update data pelanggan bisa dilakukanbiar saat cek tagihan seperti listrik  internet cukup melalui aplikasi pln mobilethanks,"['aplikasi', 'sdh', 'bagus', 'kurang', 'nya', 'tdk', 'update', 'data', 'langgan', 'ecek', 'tagih', 'icconet', 'daftar', 'icconet', 'aplikasi', 'pln', 'mobile', 'moga', 'depan', 'update', 'data', 'langgan', 'dilakukanbiar', 'cek', 'tagih', 'listrik', 'internet', 'aplikasi', 'pln', 'mobilethanks']"
5,2022-06-02 16:55:46,aplikasi ini sangat bermanfaatapa lagi waktu ada gangguansaya berikan laporan dan tanggapan  respon dari petugas pln nya sangat cepat terima kasih,"['aplikasi', 'bermanfaatapa', 'gangguansaya', 'lapor', 'tanggap', 'respon', 'tugas', 'pln', 'nya', 'cepat', 'terima', 'kasih']"
1,2022-06-02 15:06:56,aplikasi error atau bagaimana sih  saya beli token listrik pembayaran sudah berhasil tapi masih menunggu pembayaran di aplikasi plnnya lalu token saya bagaimana nasib nya,"['aplikasi', 'error', 'sih', 'beli', 'token', 'listrik', 'bayar', 'hasil', 'tunggu', 'bayar', 'aplikasi', 'plnnya', 'token', 'nasib', 'nya']"
1,2022-06-02 14:01:45,update yang terbaru tidak bagus tdk seperti versi sebelumnya versi sekarang jelek ketika saya beli token pembayaran di bank sudah terkonfirmasi namun dari pln mobile belum terkonfirmasi tolong diperhatikan dan diperbaiki secepatnya,"['update', 'baru', 'bagus', 'tdk', 'versi', 'versi', 'jelek', 'beli', 'token', 'bayar', 'bank', 'konfirmasi', 'pln', 'mobile', 'konfirmasi', 'tolong', 'perhati', 'baik', 'cepat']"
5,2022-06-02 09:14:49,apk keren sangat memudahkan untuk melihat status id listrik kita dan lebih mudah dalam hal penyelesaian masalah terkait listrik khususnya saya yang minim ilmunya dan tinggal di kontrakan sebagai anak rantau bersama adik saya semoga apk nya semakin baik dan jaya terus indonesia ku,"['apk', 'keren', 'mudah', 'status', 'id', 'listrik', 'mudah', 'selesai', 'kait', 'listrik', 'minim', 'ilmu', 'tinggal', 'kontra', 'anak', 'rantau', 'adik', 'moga', 'apk', 'nya', 'jaya', 'indonesia', 'ku']"
5,2022-06-01 22:55:24,untuk apk pln mobile agar dapat meningkatkan performance nya terima kasih atas respon cepat pengaduannya bintangnya jadi tambah  terus pertahankan,"['apk', 'pln', 'mobile', 'tingkat', 'performance', 'nya', 'terima', 'kasih', 'respon', 'cepat', 'adu', 'bintang', 'tahan']"
5,2022-06-01 18:16:13,layanan untuk pengaduan hal padam listrik sangat responsif cepat dan memuaskan anda semua di pln layak dapet bintang,"['layan', 'adu', 'padam', 'listrik', 'responsif', 'cepat', 'muas', 'pln', 'layak', 'dapet', 'bintang']"
3,2022-06-01 16:49:42,registrasi data ktp ga bisa masuk kanfirmasi loading terus laporan ke website disuruh ke aplikasi pakai aplikasi nya eroorr kalau belum siap seharusnya jangan dilunching dulu kesannya sengaja ga mau melayani miris dan pusing kalau lagi di buru deathline kasih bintang  aja maaf,"['registrasi', 'data', 'ktp', 'ga', 'masuk', 'kanfirmasi', 'loading', 'lapor', 'website', 'suruh', 'aplikasi', 'pakai', 'aplikasi', 'nya', 'eroorr', 'dilunching', 'kesan', 'sengaja', 'ga', 'layan', 'miris', 'pusing', 'buru', 'deathline', 'kasih', 'bintang', 'aja', 'maaf']"
4,2022-06-01 10:55:33,aplikasinya udah bagus cuma saran min masalah layanan pembayarannya tlg di hilangkan di semua bank jangan cuma dari bank mandiri aja yang rp  atau bisa disediakan menu top up saldo biar memudahkn masalah pembayaran tq,"['aplikasi', 'udah', 'bagus', 'saran', 'min', 'layan', 'bayar', 'tlg', 'hilang', 'bank', 'bank', 'mandiri', 'aja', 'rp', 'sedia', 'menu', 'top', 'up', 'saldo', 'biar', 'memudahkn', 'bayar', 'tq']"
5,2022-06-01 07:39:58,sangat bermanfaat bisa cek tagihan bulanan mudah utk komunikasi ke pln nya mau ngadu alhamdulillah langsung ditanggapi dan cepat penanganannya semoga dipertahankan terima kasih pln,"['manfaat', 'cek', 'tagih', 'bulan', 'mudah', 'utk', 'komunikasi', 'pln', 'nya', 'ngadu', 'alhamdulillah', 'langsung', 'tanggap', 'cepat', 'tangan', 'moga', 'tahan', 'terima', 'kasih', 'pln']"
1,2022-06-01 01:15:33,aplikasi untuk pengaduan tidak sesuai dengan kondisi lapangan infonya nyala tapi masih padam atau emang bagian lapangan yang krng max khusus wilayah jember desa balung kalau padam pasti lebih dari  jam apa karena perdesaan penangan mang lambat,"['aplikasi', 'adu', 'sesuai', 'kondisi', 'lapang', 'info', 'nyala', 'padam', 'emang', 'lapang', 'krng', 'max', 'khusus', 'wilayah', 'jember', 'desa', 'balung', 'padam', 'jam', 'desa', 'nang', 'mang', 'lambat']"
2,2022-05-31 23:12:44,fitur live chat tdk bs digunakan krn sy tidak bs melakukan pengetikan pd saat menggunakan fitur tsb upgrade verifikasinya tdk x jam spt yg di informasikan,"['fitur', 'live', 'chat', 'tdk', 'bs', 'krn', 'sy', 'bs', 'keti', 'pd', 'fitur', 'tsb', 'upgrade', 'verifikasi', 'tdk', 'x', 'jam', 'spt', 'yg', 'informasi']"
3,2022-05-31 18:33:43,aplikasinya gimana si ini mau daftar tambah daya listrik gabisa harus verifikasi data diri dulu tapi setelah diverifikasi tetap aja g bisa tolong penjelasannya,"['aplikasi', 'gimana', 'si', 'daftar', 'daya', 'listrik', 'gabisa', 'verifikasi', 'data', 'verifikasi', 'aja', 'g', 'tolong', 'jelas']"
3,2022-05-31 17:42:01,klw aplikasi untk mempermudah kenapa konfirmasi harus ke kantor lagi pak untk konfirmasi pelunasan tagihan dan penyambung kembali arus listrik saya pikir aplikasi ini mempermudah semuanya ternyata belum sempurna,"['klw', 'aplikasi', 'untk', 'mudah', 'konfirmasi', 'kantor', 'untk', 'konfirmasi', 'lunas', 'tagih', 'sambung', 'arus', 'listrik', 'pikir', 'aplikasi', 'mudah', 'sempurna']"
4,2022-05-31 17:17:44,min saya sudah bikin akun daftar dan log in dgn no hp tapi ketika log out dan log in dengan no hp yg sama tidak bisa masuk notifikasinya nomor hp anda sudah pernah dipakai mohon dibantu min karena no hp yg saya pakai tersebut untuk verifikasi data pada aplikasi pln mobile,"['min', 'bikin', 'akun', 'daftar', 'log', 'in', 'dgn', 'no', 'hp', 'log', 'out', 'log', 'in', 'no', 'hp', 'yg', 'masuk', 'notifikasi', 'nomor', 'hp', 'pakai', 'mohon', 'bantu', 'min', 'no', 'hp', 'yg', 'pakai', 'verifikasi', 'data', 'aplikasi', 'pln', 'mobile']"
3,2022-05-31 16:36:27,ini knp y hari ini aplikasi mobile pln setelah update jadi ga bisa pilih pengaduan data kosong terussaya sudah ikutin arahan hapus cache dan isi form tetep aja data kosong di sub menu pengaduan ya,"['knp', 'y', 'aplikasi', 'mobile', 'pln', 'update', 'ga', 'pilih', 'adu', 'data', 'kosong', 'terussaya', 'ikutin', 'arah', 'hapus', 'cache', 'isi', 'form', 'tetep', 'aja', 'data', 'kosong', 'sub', 'menu', 'adu', 'ya']"
1,2022-05-31 12:13:24,kenapa setelah di perbaharui aplikasinya untuk pengaduan kok malah tidak bisa data masih kosong  muat ulang tidak ada respon mohon petunjuknya biar bisa melakukan pengaduan lewat aplikasi,"['baharu', 'aplikasi', 'adu', 'data', 'kosong', 'muat', 'ulang', 'respon', 'mohon', 'tunjuk', 'biar', 'adu', 'aplikasi']"
1,2022-05-31 10:30:21,laporan kelistrikan di persulit padahal sudah di kasi tau masalahnya cuma si isi pulsa gagal terus dan di pastikan kwh minta di sering nomor barutapi pelayanan super ribetakhirnya laporan tidak di tindak lanjutilaporan sudah capek nulis dan nunggu antrian lama banget gak keproses sungguh mengecewakan,"['lapor', 'listrik', 'sulit', 'kasi', 'tau', 'si', 'isi', 'pulsa', 'gagal', 'pasti', 'kwh', 'nomor', 'barutapi', 'layan', 'super', 'ribetakhirnya', 'lapor', 'tindak', 'lanjutilaporan', 'capek', 'nulis', 'nunggu', 'antri', 'banget', 'gak', 'proses', 'sungguh', 'kecewa']"
1,2022-05-31 07:06:51,aplikasi ga mutu apalagi marketplace pln saldo gopay saya sudah terpotong tapi seller ga nerima notifikasi ad pembelian buk notifikasi layar putih doank komplin berkali kali nelponin  bilangnya keluhannya akan dtambahkan dapet email klo komplin udah seesai setelah dcek ternyata sama aja apanya yg dselesaikan akhirnya nelpon lagi ngabisin pulsa lgi ga slese chat penjual dbilang ga ad notifikasi masuk untuk dproses ya tuhan aplikasi ini ga pantas ddonwload ga mutu  ga guna,"['aplikasi', 'ga', 'mutu', 'marketplace', 'pln', 'saldo', 'gopay', 'potong', 'seller', 'ga', 'nerima', 'notifikasi', 'ad', 'beli', 'buk', 'notifikasi', 'layar', 'putih', 'doank', 'komplin', 'kali', 'kali', 'nelponin', 'bilang', 'keluh', 'dtambahkan', 'dapet', 'email', 'klo', 'komplin', 'udah', 'esa', 'dcek', 'aja', 'apa', 'yg', 'dselesaikan', 'nelpon', 'ngabisin', 'pulsa', 'lgi', 'ga', 'slese', 'chat', 'jual', 'dbilang', 'ga', 'ad', 'notifikasi', 'masuk', 'dproses', 'ya', 'tuhan', 'aplikasi', 'ga', 'ddonwload', 'ga', 'mutu', 'ga']"
5,2022-05-31 01:03:26,saran dari saya yang pengguna listrik pascabayar tolong ditingkatkan lagi fitur perihal tagihan listrik jadi kalo semisal ada tunggakan nantinya bisa diakumulasi dengan bulan berikutnya jangan dibuat perbulan gitu dikhawatirkan ada miskomunikasi antara yang di aplikasi dengan yang di lapang apalagi sekarang semua serba digital terimakasih sukses selalu,"['saran', 'guna', 'listrik', 'pascabayar', 'tolong', 'tingkat', 'fitur', 'perihal', 'tagih', 'listrik', 'kalo', 'tunggak', 'akumulasi', 'bulan', 'gitu', 'khawatir', 'miskomunikasi', 'aplikasi', 'lapang', 'serba', 'digital', 'terimakasih', 'sukses']"
5,2022-05-30 19:36:45,sangat membantu sekali aplikasinya tida perlu repot² ke kantor mengantri dan csnya sangat responsif good luck pln mobile semoga tambah baik lagi ke depannya,"['bantu', 'aplikasi', 'tida', 'repot', 'kantor', 'antri', 'csnya', 'responsif', 'good', 'luck', 'pln', 'mobile', 'moga', 'depan']"
5,2022-05-30 19:01:25,terimakasih dengan adanya apk pln mobile sangat dan sangat membantu praktis dan nyaman respon cepat dan tepat klo ada seribu bintangnya pasti ku klik semua trimakasih atas kerja samanya,"['terimakasih', 'apk', 'pln', 'mobile', 'bantu', 'praktis', 'nyaman', 'respon', 'cepat', 'klo', 'ribu', 'bintang', 'ku', 'klik', 'trimakasih', 'kerja', 'sama']"
1,2022-05-30 16:53:18,untuk penyedia iconnet kenapa sering sekali erorr bukan  atau  jam melainkan bisa berhari hari tolong segera diperbaiki jangan sampai pelanggan iconnet kecewa karena sering error tapi tagihan harus bayar full trima kasih,"['sedia', 'iconnet', 'erorr', 'jam', 'hari', 'tolong', 'baik', 'langgan', 'iconnet', 'kecewa', 'error', 'tagih', 'bayar', 'full', 'trima', 'kasih']"
5,2022-05-30 15:40:51,ok nih mantapp mungkin nanti bisa ditingkatkan lg bisa periksa jumlah token yang tersisa di kwh dengan angka akurat dan ada pemberitahuan jika akan ada pemadaman listrik agar kita bisa bersiapsiap,"['ok', 'nih', 'mantapp', 'tingkat', 'lg', 'periksa', 'token', 'sisa', 'kwh', 'angka', 'akurat', 'pemberitahuan', 'madam', 'listrik', 'bersiapsiap']"
4,2022-05-30 09:46:54,aplikasi ini bagus bisa tahu transaksi dengan pln tapi sayang kenapa kalau beli token listrik harus diinput secara manual sebaiknya ditingkatkan sehingga kalau beli token bisa langsung menambah tanpa harus menginput token tersebut,"['aplikasi', 'bagus', 'transaksi', 'pln', 'sayang', 'beli', 'token', 'listrik', 'diinput', 'manual', 'tingkat', 'beli', 'token', 'langsung', 'tambah', 'menginput', 'token']"
4,2022-05-30 08:47:58,respon cepat dan baik tp di aplikasi dan dilapangan beda tapi untuk keseluruhan baik dan mempermudah pelanggan untuk pengaduan terima kasih,"['respon', 'cepat', 'tp', 'aplikasi', 'lapang', 'beda', 'mudah', 'langgan', 'adu', 'terima', 'kasih']"
5,2022-05-30 07:33:28,dengan adanya aplikasi pln mobile ini sangat mempermudah untuk melakukan pengaduan terkait masalah kelistrikan kita petugasnya juga fast respon tidak terlalu menunggu lama konfirmasinya berdasarkan pengalaman saya atas pengaduan isi token gagal hanya  jam  menit sudah ada konfirmasi,"['aplikasi', 'pln', 'mobile', 'mudah', 'adu', 'kait', 'listrik', 'tugas', 'fast', 'respon', 'tunggu', 'konfirmasi', 'dasar', 'alam', 'adu', 'isi', 'token', 'gagal', 'jam', 'menit', 'konfirmasi']"
1,2022-05-30 07:21:34,susah sekali untuk melakukan pasang baru sangat ribet katannya mau menghindari calo tapi negara kok bikin pemasangan sesusah ini,"['susah', 'pasang', 'ribet', 'katannya', 'hindar', 'calo', 'negara', 'bikin', 'pasang', 'susah']"
1,2022-05-30 00:07:04,live chaat dengan cs tapi tidak bisa mengetik mau ngetik gk bisa maksudnya kaya gimana tu ya apa fungsinya papan keyboardnya aplikasi buruk,"['live', 'chaat', 'cs', 'etik', 'ngetik', 'gk', 'maksud', 'kaya', 'gimana', 'tu', 'ya', 'fungsi', 'papan', 'keyboardnya', 'aplikasi', 'buruk']"
1,2022-05-29 22:13:17,saya pengguna iconnet dari awal tahun  dari awal pakai sampai saat ini kecewa saya adl ketika jaringan internet nya bermasalah pengaduan sudah saya lakukan melalui telfon atau wa tetapi sesudahnya perbaikan nya sangat lama  hari yang lalu internet saya tidak bisa digunakan karena ada lampu merah di modem dan sudah lebih x saya komplain tapi masih belum diperbaiki juga pdhl tetangga saya yg juga pakai iconnet tidak ada masalah sangat kecewa dalam quick respon dari perbaikannya,"['guna', 'iconnet', 'pakai', 'kecewa', 'adl', 'jaring', 'internet', 'nya', 'masalah', 'adu', 'laku', 'telfon', 'wa', 'baik', 'nya', 'internet', 'lampu', 'merah', 'modem', 'x', 'komplain', 'baik', 'pdhl', 'tetangga', 'yg', 'pakai', 'iconnet', 'kecewa', 'quick', 'respon', 'baik']"
1,2022-05-29 17:00:33,error atau apa transaksi pengisian token tidak tertera ga bs cek pemakaian juga yg tertera malah token hampir habis padalah baru di isi masih bagus aplikasi yang lama setelah diperbaharui semakin tidak jelas,"['error', 'transaksi', 'isi', 'token', 'tera', 'ga', 'bs', 'cek', 'pakai', 'yg', 'tera', 'token', 'habis', 'pada', 'isi', 'bagus', 'aplikasi', 'baharu']"
1,2022-05-29 14:15:01,aplikasinya jelek berkalikali laporan pakek aplikasi ini gak bisabisa giliran pertengahan keluar sendiri aplikasinya operator pln pusat nyuruh pakek aplikasi aplikasinya jelek gini sampek ganti kartu paketan tetep gak bisa diguunakan ini padahal jaringan g full,"['aplikasi', 'jelek', 'berkalikali', 'lapor', 'pakek', 'aplikasi', 'gak', 'bisabisa', 'gilir', 'tengah', 'aplikasi', 'operator', 'pln', 'pusat', 'nyuruh', 'pakek', 'aplikasi', 'aplikasi', 'jelek', 'gin', 'sampek', 'ganti', 'kartu', 'paket', 'tetep', 'gak', 'diguunakan', 'jaring', 'g', 'full']"
5,2022-05-29 13:59:09,saya sudah punya akun kenapa gak bisa masuk malahbalik lagi kemenu masukan data n bla bla bla tks sekarang udah bisa masuk penangananaplikasinya cepat,"['akun', 'gak', 'masuk', 'malahbalik', 'menu', 'masuk', 'data', 'n', 'bla', 'bla', 'bla', 'tks', 'udah', 'masuk', 'penangananaplikasinya', 'cepat']"
5,2022-05-29 13:46:21,saya mau tanya disini kan untuk pengajuan listrik nya dan untuk pembuatan nidi dan slo itu dengan pihak ke tiga melalui si ujang gatrik saya itu buat nidi di tarik harga  dan pihak tt itu tidak ada survey ke rumah saya dan slo nya itu dengan pihak yang sama cuma namanya beda di tarik  tapi prosesnya lama hampir  hari dan pihak tt itu berbelit saya sampek mah lapor polisi atas tuduhan pemerasan dan penipuan kenapa sih harus seperti ini pihak tt nya itu kurang tertib,"['aju', 'listrik', 'nya', 'buat', 'nidi', 'slo', 'si', 'ujang', 'gatrik', 'nidi', 'tarik', 'harga', 'tt', 'survey', 'rumah', 'slo', 'nya', 'nama', 'beda', 'tarik', 'proses', 'tt', 'belit', 'sampek', 'mah', 'lapor', 'polisi', 'tuduh', 'peras', 'tipu', 'sih', 'tt', 'nya', 'tertib']"
4,2022-05-29 13:01:51,saya memiliki rumah yang tidak ditinggali karena jarang kesana kondisi token selalu kehabisan jadi setiap kali mau isi token harus laporan pihak pln alhamdulillah respon cepat tapi disini saya merasa menjadi penyebab masalah ini mungkin banyak jg pelanggan dengan kondisi seperti saya saran saya tolong untuk top up saldo pln tidak perlu input kode di kwh jadi jika posisi kami di luar kota pun kami bisa kontrol soal pembayarannya terima kasih,"['milik', 'rumah', 'tinggal', 'jarang', 'kesana', 'kondisi', 'token', 'habis', 'kali', 'isi', 'token', 'lapor', 'pln', 'alhamdulillah', 'respon', 'cepat', 'sebab', 'jg', 'langgan', 'kondisi', 'saran', 'tolong', 'top', 'up', 'saldo', 'pln', 'input', 'kode', 'kwh', 'posisi', 'kota', 'kontrol', 'bayar', 'terima', 'kasih']"
2,2022-05-29 11:21:18,aplikasinya lemot bangetapalg pas mau belanja di market placenyasebenrnya paling kecewa dgn csnya jginfonya selalu g lengkaphrs bolakbalik telp br tau aturan main lebaran ceriahrsnya x telp diinfokan semuanyag pernah dikasih tau  akun hny bs x pengajuanjd belanja yg g perlu di marketplacenyag diinfo jgdiminta npwp pelangganpdhl sdh ditnya bolakbalik apa saja yg diperlukansy komplain disini krn terkait hrs menggunakan aplikasi ini utk dpt promo lebaran ceria,"['aplikasi', 'lot', 'bangetapalg', 'pas', 'belanja', 'market', 'placenyasebenrnya', 'kecewa', 'dgn', 'csnya', 'jginfonya', 'g', 'lengkaphrs', 'bolakbalik', 'telp', 'br', 'tau', 'atur', 'main', 'lebaran', 'ceriahrsnya', 'x', 'telp', 'info', 'semuanyag', 'kasih', 'tau', 'akun', 'hny', 'bs', 'x', 'pengajuanjd', 'belanja', 'yg', 'g', 'marketplacenyag', 'info', 'jgdiminta', 'npwp', 'pelangganpdhl', 'sdh', 'ditnya', 'bolakbalik', 'yg', 'diperlukansy', 'komplain', 'krn', 'kait', 'hrs', 'aplikasi', 'utk', 'dpt', 'promo', 'lebaran', 'ceria']"
1,2022-05-28 23:08:11,gimana sih lawak banget admin aplikasinya masa di keterangan pengaduan  selesai  padahal hasil nya gak ada laporan pengaduan gak di tanggapi tapi di keterangan udah selesai tolonglah kebijakannya bos katanya tunggu aja paling lama  jam,"['gimana', 'sih', 'lawak', 'banget', 'admin', 'aplikasi', 'terang', 'adu', 'selesai', 'hasil', 'nya', 'gak', 'lapor', 'adu', 'gak', 'tanggap', 'terang', 'udah', 'selesai', 'tolong', 'bijak', 'bos', 'tunggu', 'aja', 'jam']"
1,2022-05-28 23:06:01,dalam hal pelayanan pln selalu sama saja dari sebelum dan sesudah ada aplikasi ini apa yang dikatakan aplikasi tidak sesuai dengan pelayanan dilapangan tim penugasan perbaikan tidak sesuai dengan apa yang dinyatakan didalam aplikasi yang tiba dalam  menit itu hanya omongan belaka pln hanya mengejar rating di aplikasi menyala dilapangan tidak,"['layan', 'pln', 'aplikasi', 'aplikasi', 'sesuai', 'layan', 'lapang', 'tim', 'tugas', 'baik', 'sesuai', 'nyata', 'dalam', 'aplikasi', 'menit', 'omong', 'belaka', 'pln', 'kejar', 'rating', 'aplikasi', 'nyala', 'lapang']"
1,2022-05-28 18:03:33,hai pln tolong donk ditingkatkan pelayanan kepada pelanggankhususnya untuk pln kota probolinggo sungguh lelet sekalisaya sudah komplain ke pln mobile layanan  dis jatim maupun pln pusat tapi sungguh sangat mengecewakanperumahan saya di kec kanigaran dalam waktu tahun terakhir frekuensi pemadaman seminggu bisa  hingga x padam padahal ditahun sebelum sebelumnya setahun ga pernah terjadi seperti inientah apa kendalanya dari petugas lapangan pun ga pernah menjelaskan ke kami,"['hai', 'pln', 'tolong', 'donk', 'tingkat', 'layan', 'pelanggankhususnya', 'pln', 'kota', 'probolinggo', 'sungguh', 'lelet', 'sekalisaya', 'komplain', 'pln', 'mobile', 'layan', 'dis', 'jatim', 'pln', 'pusat', 'sungguh', 'mengecewakanperumahan', 'kec', 'kanigaran', 'frekuensi', 'madam', 'minggu', 'x', 'padam', 'tahun', 'tahun', 'ga', 'inientah', 'kendala', 'tugas', 'lapang', 'ga']"
5,2022-05-28 17:53:32,aplikasinya bagus saran saja pd menu pengaduan mungkin bisa ditambahkan tombol  pilihan utk menyatakan gangguan sudah bisa terselesaikan sendiri ada kalanya kami sudah lapor terjadi gangguan namun bisa jadi ada tetangga atau kerabat yang tiba datang membantu permasalah tsb dan bisa selesai atau barangkali sj sdh ada menu tsb namun saya belum mengetahuinya salam hebat,"['aplikasi', 'bagus', 'saran', 'pd', 'menu', 'adu', 'tombol', 'pilih', 'utk', 'ganggu', 'selesai', 'kala', 'lapor', 'ganggu', 'tetangga', 'kerabat', 'bantu', 'masa', 'tsb', 'selesai', 'barangkali', 'sj', 'sdh', 'menu', 'tsb', 'tahu', 'salam', 'hebat']"
5,2022-05-28 16:24:07,aplikasi pln mobile harus terus di upgrade terkait menu pengaduan itu harusnya ada estimasi kapan pekerjaan selesai dan apa saja kendala petugas di lapangan jadi kita sbgai costomer tidak hanya menunggu dan bertanya dan petugas lapangan pun terkadang ada memberikan konfirmasi dan kadang tidak sprti kpan pengerjaan selesai bisa cepat tapi sering lelet sprti sekarang sudah  jam listrik belum juga nyala dan kepastian kpan listrik nyala pun tidak ada dari aplikasi maupun petugas terkait,"['aplikasi', 'pln', 'mobile', 'upgrade', 'kait', 'menu', 'adu', 'estimasi', 'kerja', 'selesai', 'kendala', 'tugas', 'lapang', 'sbgai', 'costomer', 'tunggu', 'tugas', 'lapang', 'terkadang', 'konfirmasi', 'kadang', 'sprti', 'kpan', 'kerja', 'selesai', 'cepat', 'lelet', 'sprti', 'jam', 'listrik', 'nyala', 'pasti', 'kpan', 'listrik', 'nyala', 'aplikasi', 'tugas', 'kait']"
4,2022-05-28 15:07:34,riwayat pembelian token tidak cepat update padahal pembelian di tgl mei ada tapi ke baca terakhir tgl mei padahal baru di isi rb token pemberitahuan di aplikasi token anda mau habis tolong di perbaiki ingat hak konsumen,"['riwayat', 'beli', 'token', 'cepat', 'update', 'beli', 'tgl', 'mei', 'baca', 'tgl', 'mei', 'isi', 'rb', 'token', 'pemberitahuan', 'aplikasi', 'token', 'habis', 'tolong', 'baik', 'hak', 'konsumen']"
2,2022-05-28 11:37:59,notifikasi token tak tepat krn stok token masih banyak dipemberitahuan kok dibilang habis dan habis ngisi token tetep notifikasinya tak berubah dibilang segera habis mhn perbaikan sistem aplukasinya,"['notifikasi', 'token', 'krn', 'stok', 'token', 'dipemberitahuan', 'bilang', 'habis', 'habis', 'ngisi', 'token', 'tetep', 'notifikasi', 'ubah', 'bilang', 'habis', 'mhn', 'baik', 'sistem', 'aplukasinya']"
1,2022-05-28 10:13:29,pelayanan contact centrenya sgt buruk terutama via whatsapp sy sudah komplain berkali lewat whatsapl lewat ig lewat email keluhan ttep sama jaringan iconnet sangat lelet kbtulan sy pakai yg mbps sy speedtest hanya sampai mbps downloadnya upload emg mbps berkali sy email sy ingin petugasnya dtg krumah untuk mengcek semoga lewat sni bisa diperhatikan keluhan sy email dan whatsapp sudah tdk mempan sy kasi bintang  buruk playanan,"['layan', 'contact', 'centrenya', 'sgt', 'buruk', 'via', 'whatsapp', 'sy', 'komplain', 'kali', 'whatsapl', 'ig', 'email', 'keluh', 'ttep', 'jaring', 'iconnet', 'lelet', 'kbtulan', 'sy', 'pakai', 'yg', 'mbps', 'sy', 'speedtest', 'mbps', 'downloadnya', 'upload', 'emg', 'mbps', 'kali', 'sy', 'email', 'sy', 'tugas', 'dtg', 'krumah', 'mengcek', 'moga', 'sni', 'perhati', 'keluh', 'sy', 'email', 'whatsapp', 'tdk', 'mempan', 'sy', 'kasi', 'bintang', 'buruk', 'playanan']"
5,2022-05-28 02:00:36,awal nya agak bingung mengunakan nya tapi dicoba trus jd bisa semoga cepat di respon bila ada gangguan listrik,"['nya', 'bingung', 'mengunakan', 'nya', 'coba', 'trus', 'jd', 'moga', 'cepat', 'respon', 'ganggu', 'listrik']"
