rating,waktu,text_clean,text_preprocessed
5,2022-04-28 15:25:48,mantap aplikasinya praktis dan banyak fiturnya memudahkan untuk membuat laporan tanpa harus telfon ke  jadi hemat pulsa,"['mantap', 'aplikasi', 'praktis', 'fiturnya', 'mudah', 'lapor', 'telfon', 'hemat', 'pulsa']"
5,2022-04-28 14:23:26,sangat membantu sekali kita bisa dapat informasi tentang pemadaman listrik dll yang berkaitan dengan listrik  perubahan daya pasang barulaporan gangguanbahkan sampai pembelian token listrik terima kasih pln mobile,"['bantu', 'informasi', 'madam', 'listrik', 'dll', 'kait', 'listrik', 'ubah', 'daya', 'pasang', 'barulaporan', 'gangguanbahkan', 'beli', 'token', 'listrik', 'terima', 'kasih', 'pln', 'mobile']"
5,2022-04-28 14:16:06,dengan adanya apl ini semua jadi mudah tanpa harus datang ke kantor pln cukup melalui aplikasi ini petugas cepat datang dan tanggapterima kasih plnsemoga kedepan tambah sukses,"['apl', 'mudah', 'kantor', 'pln', 'aplikasi', 'tugas', 'cepat', 'tanggapterima', 'kasih', 'plnsemoga', 'depan', 'sukses']"
5,2022-04-28 13:55:30,sekarang sangat terbantu syekaleeee ada aplikasi pln mobile sangat membantu pengaduan listrik dengan mudah hanya dengan jaringan internet good job,"['bantu', 'syekaleeee', 'aplikasi', 'pln', 'mobile', 'bantu', 'adu', 'listrik', 'mudah', 'jaring', 'internet', 'good', 'job']"
5,2022-04-28 13:33:37,aplikasi yang sangat membantu bisa mengetahui info pemadaman tagihan listrik pasang baru tambah data dan bisa untuk pengaduan juga,"['aplikasi', 'bantu', 'info', 'madam', 'tagih', 'listrik', 'pasang', 'data', 'adu']"
5,2022-04-28 13:22:01,terima kasih kepada pln yg telah meluncurkan app pln mobileyang telah memberikan kemudahan dalam setiap masalah dan keperluan khususnya dalam bidang kelistrikansemoga kedepan nya lebih di tingkatkan lagi perform nya dalam aplikasi nya,"['terima', 'kasih', 'pln', 'yg', 'luncur', 'app', 'pln', 'mobileyang', 'mudah', 'perlu', 'bidang', 'kelistrikansemoga', 'depan', 'nya', 'tingkat', 'perform', 'nya', 'aplikasi', 'nya']"
5,2022-04-28 13:15:02,tiga bintang dulu baru coba di aplikasi sudah terintegrasi ke linkaja mau ku aktifkan kok tidak bisa dengan balasan nomer sudah terdaftar silahkan masukkan nomer lain lah bagaimana ini team suport kan tinggal di koneksi kan ke linkaja nmr saya knp harus pake nmr lain sudah terkondisikan  buat pln mobile great servis,"['bintang', 'coba', 'aplikasi', 'integrasi', 'linkaja', 'ku', 'aktif', 'balas', 'nomer', 'daftar', 'silah', 'masuk', 'nomer', 'team', 'suport', 'tinggal', 'koneksi', 'linkaja', 'nmr', 'knp', 'pake', 'nmr', 'kondisi', 'pln', 'mobile', 'great', 'servis']"
4,2022-04-28 13:10:35,aplikasinya positif membantu mempermudah pelayanan konsumen kalo boleh usul untuk tgl pencatatan meter ditambah waktunya jadi semingguahir bulan biar ga kelewat tglnya makasih,"['aplikasi', 'positif', 'bantu', 'mudah', 'layan', 'konsumen', 'kalo', 'usul', 'tgl', 'catat', 'meter', 'tambah', 'semingguahir', 'biar', 'ga', 'lewat', 'tglnya', 'makasih']"
5,2022-04-28 12:48:46,pake pln mobile infomatif banget buat tracking kalo pas rumah padam apalagi fitur swacamnya mantap dan praktis tinggal foto angka stand di kwh meternya kirim deh bisa ngecek estimasi jumlah tagihannya juga,"['pake', 'pln', 'mobile', 'infomatif', 'banget', 'tracking', 'kalo', 'pas', 'rumah', 'padam', 'fitur', 'swacamnya', 'mantap', 'praktis', 'tinggal', 'foto', 'angka', 'stand', 'kwh', 'meter', 'kirim', 'deh', 'ngecek', 'estimasi', 'tagih']"
5,2022-04-28 12:43:04,terimakasih petugas pln pondok gede sudah menangani gangguannyarespon cepat petugas baik ramahmohon maaf menyebabkan berulangkarna saya yang lapor tidak di lokasi dan di laporkan hanya mencantumkan no pelanggantidak mencantumkan no saya,"['terimakasih', 'tugas', 'pln', 'pondok', 'gede', 'tangan', 'gangguannyarespon', 'cepat', 'tugas', 'ramahmohon', 'maaf', 'sebab', 'berulangkarna', 'lapor', 'lokasi', 'lapor', 'cantum', 'no', 'pelanggantidak', 'cantum', 'no']"
5,2022-04-28 07:41:24,fiturfitur dalam aplikasi sangat membantu pelanggan dalam memberikan pengaduan bahkan bisa dilacak riwayat progressnya semoga bisa makin berkembang lagi,"['fiturfitur', 'aplikasi', 'bantu', 'langgan', 'adu', 'lacak', 'riwayat', 'progressnya', 'moga', 'kembang']"
5,2022-04-28 03:01:34,sangat bermamfaat harapan agar ditambahkan fitur utk saldo top up di aplikasi bisa otomatis pada saat bertraksaksi trims pln,"['bermamfaat', 'harap', 'fitur', 'utk', 'saldo', 'top', 'up', 'aplikasi', 'otomatis', 'bertraksaksi', 'trims', 'pln']"
5,2022-04-27 20:55:36,aplikasi yg sangat membantu pelanggan dan calon pelanggan fitur yang tersedia sangat lengkap dan mudah untuk diakses semoga kedepan terus berkembang dengan fitur tambahan,"['aplikasi', 'yg', 'bantu', 'langgan', 'calon', 'langgan', 'fitur', 'sedia', 'lengkap', 'mudah', 'akses', 'moga', 'depan', 'kembang', 'fitur', 'tambah']"
2,2022-04-27 20:00:33,refund dana iconnect yg lama sampe saat ini belum ada respon padahal bukan kesalahan customer tapi memang area coveragenya agak jauh seharusnya diperbaiki jika memang area jauh dari pusatnya seharusnya tertulis tidak tercover membuat rugi pelanggan karena refund tidak tau kapan cair,"['refund', 'dana', 'iconnect', 'yg', 'sampe', 'respon', 'salah', 'customer', 'area', 'coveragenya', 'baik', 'area', 'pusat', 'tulis', 'tercover', 'rugi', 'langgan', 'refund', 'tau', 'cair']"
1,2022-04-27 18:55:06,tolong untuk setiap kali ada permohonan emailnya slalu kosong jgn seperti yg sy alami waktu permohonan pasang baru itu memang sy tetapi ada pernohonan selanjutnya dgn pelanggan yg sama itu msh memakai email sy pdhl sy tidak pernah melakukan permohonan lagi atas pelanggan tersebut,"['tolong', 'kali', 'mohon', 'email', 'slalu', 'kosong', 'jgn', 'yg', 'sy', 'alami', 'mohon', 'pasang', 'sy', 'pernohonan', 'dgn', 'langgan', 'yg', 'msh', 'pakai', 'email', 'sy', 'pdhl', 'sy', 'mohon', 'langgan']"
1,2022-04-27 18:30:26,maaf pln saya baru download dan mau pengajuan nambah daya dari aplikasi diminta upgrade akun sehingga saya upgrade dan diminta foto ktp dan foto selfi dengan ktp setelah berhasil ternyata akun saya ada yang merubah nomor telpon saya dan digunakan untuk pembuatan pemasangan baru sebanyak   saya minta bantu solusinya agar akun saya tidak disalah gunakan lagi atas perhatiannya saya ucapkan terimakasih,"['maaf', 'pln', 'download', 'aju', 'nambah', 'daya', 'aplikasi', 'upgrade', 'akun', 'upgrade', 'foto', 'ktp', 'foto', 'selfi', 'ktp', 'hasil', 'akun', 'rubah', 'nomor', 'telpon', 'buat', 'pasang', 'bantu', 'solusi', 'akun', 'salah', 'perhati', 'ucap', 'terimakasih']"
1,2022-04-27 18:22:06,permisi kok gak bisa kirim pengaduan iconnect lewat app pln mobile ya tulisannya terjadi kesalahan data tdk dapat diperoleh v padahal koneksi saya lancar aja mohon perbaiki ya terimakasih android  marsmallow,"['permisi', 'gak', 'kirim', 'adu', 'iconnect', 'app', 'pln', 'mobile', 'ya', 'tulis', 'salah', 'data', 'tdk', 'oleh', 'v', 'koneksi', 'lancar', 'aja', 'mohon', 'baik', 'ya', 'terimakasih', 'android', 'marsmallow']"
1,2022-04-27 15:46:06,verifikasi foto susah banget kualitas foto asli dan di app jauh berebeda udah ikutin petunjuk buat clearen playstore nya juga masih sama aja padahal jaringan dalam kondisi sangat lancar,"['verifikasi', 'foto', 'susah', 'banget', 'kualitas', 'foto', 'asli', 'app', 'berebeda', 'udah', 'ikutin', 'tunjuk', 'clearen', 'playstore', 'nya', 'aja', 'jaring', 'kondisi', 'lancar']"
4,2022-04-27 14:45:40,instalasi pemasangan suka error muncul tulisan di kwh periksa setiap bulan pada saat pengisian pulsa listrik seperti itu mohon diperbaiki lg sistem instalasinya terimakasih,"['instalasi', 'pasang', 'suka', 'error', 'muncul', 'tulis', 'kwh', 'periksa', 'isi', 'pulsa', 'listrik', 'mohon', 'baik', 'lg', 'sistem', 'instalasi', 'terimakasih']"
5,2022-04-27 13:33:34,aplikasi yang sangat membantu dan memudahkan bagi pelanggan pln terutama seperti saya yang memiliki kegiatan yang sangat mobil dengan aplikasi ini semua terkait produk pln bisa kita gunakan dengan mudah,"['aplikasi', 'bantu', 'mudah', 'langgan', 'pln', 'milik', 'giat', 'mobil', 'aplikasi', 'kait', 'produk', 'pln', 'mudah']"
5,2022-04-27 10:13:37,saya sebagai rakyat indonesia mengucapkan terima kasih sebanyak  banyaknya kepada pln karena telah menjaga pasokan energi listrik negri ini dan dengan adanya aplikasi pln mobile sangat membantu mempermudah kepada kami dalam hal pelayanan keperluan listrik pln terbaik thanksss,"['rakyat', 'indonesia', 'terima', 'kasih', 'banyak', 'pln', 'jaga', 'pasok', 'energi', 'listrik', 'negri', 'aplikasi', 'pln', 'mobile', 'bantu', 'mudah', 'layan', 'perlu', 'listrik', 'pln', 'baik', 'thanksss']"
2,2022-04-27 02:37:09,pakai aplikasi yg seharusnya dipermudah ini malah semakin sulitgk semua lapisan masyarakat paham internet dan wajib daftar via pln mobiledan yg membuat kecewa di apl jelas dapat subsidi dan anehnya setelah pelunasan baru dapat notif kalau nik sudah terpakai dan alamat tidak sesuai ktphelloooo kenapa tidak dari awal daftar saja pemberitahuannya biar kita gak repot bayar kalau ujungnya ditolak dan uang dikembalikan kalau aplikasi blm siap mendingan balik ke manual saja lebih mudah,"['pakai', 'aplikasi', 'yg', 'mudah', 'sulitgk', 'lapis', 'masyarakat', 'paham', 'internet', 'wajib', 'daftar', 'via', 'pln', 'mobiledan', 'yg', 'kecewa', 'apl', 'subsidi', 'aneh', 'lunas', 'notif', 'nik', 'pakai', 'alamat', 'sesuai', 'ktphelloooo', 'daftar', 'pemberitahuannya', 'biar', 'gak', 'repot', 'bayar', 'ujung', 'tolak', 'uang', 'kembali', 'aplikasi', 'blm', 'mending', 'manual', 'mudah']"
5,2022-04-27 00:40:31,terima kasih pln mobile sangat membantu untuk kedepannya harap respon cepat tanggapnya lebih baik lagi ya dalam membantu terlebih kami yang didaerah terpencil,"['terima', 'kasih', 'pln', 'mobile', 'bantu', 'depan', 'harap', 'respon', 'cepat', 'tanggap', 'ya', 'bantu', 'daerah', 'pencil']"
4,2022-04-26 22:37:58,cukup membatutp saya coba belanja d marketplace pln mobileudah hampir mau  bulan barang masih belum d kirimmau nanya kapan d kirimga ada fitur pesan nyasebaiknya kalo belum siap jangan dulu d promosikanterima kasih,"['membatutp', 'coba', 'belanja', 'd', 'marketplace', 'pln', 'mobileudah', 'barang', 'd', 'kirimmau', 'nanya', 'd', 'kirimga', 'fitur', 'pesan', 'nyasebaiknya', 'kalo', 'd', 'promosikanterima', 'kasih']"
5,2022-04-26 21:15:08,saya sangat senang dan puas dengan aplikasi ini yang mana sangat membantu pelanggan pln di mana fitur yang ada di aplikasi mudah di pahami dan di gunakan,"['senang', 'puas', 'aplikasi', 'bantu', 'langgan', 'pln', 'fitur', 'aplikasi', 'mudah', 'paham']"
4,2022-04-26 19:26:31,saran saya sistem keamanannya ditingkatkan lagi kemarin dapat email notifikasi kalau nomor telepon yang terdaftar di pln mobile telah diganti nomor lain nggak tau nomor siapa itu saya juga gak pernah menggantinya,"['saran', 'sistem', 'aman', 'tingkat', 'kemarin', 'email', 'notifikasi', 'nomor', 'telepon', 'daftar', 'pln', 'mobile', 'ganti', 'nomor', 'nggak', 'tau', 'nomor', 'gak', 'ganti']"
5,2022-04-26 15:27:44,setelah di update pemberian rating layanan menjadi tidak ada kalau begini jadi tidak terbangun reformasi layanan pln khusus nya bagian teknis apalagi pada rayon yg sangat tidak respond pada gangguan,"['update', 'beri', 'rating', 'layan', 'bangun', 'reformasi', 'layan', 'pln', 'khusus', 'nya', 'teknis', 'rayon', 'yg', 'respond', 'ganggu']"
5,2022-04-26 15:26:49,aplikasi mantab gampang beli token listrik serius gak kena biaya adm lho kalau beli lwt mbanking kena adm minimal  lwt aplikasi ini gratististiscoba aja  kali isi ulang token dikali  perak berapa uang kalian yg hilang kalau beli pulsa listriknya lwt mbangkingmakanya ayoo isi token lwt aplikasi pln mobile,"['aplikasi', 'mantab', 'gampang', 'beli', 'token', 'listrik', 'serius', 'gak', 'kena', 'biaya', 'adm', 'lho', 'beli', 'lwt', 'mbanking', 'kena', 'adm', 'minimal', 'lwt', 'aplikasi', 'gratististiscoba', 'aja', 'kali', 'isi', 'ulang', 'token', 'kali', 'perak', 'uang', 'yg', 'hilang', 'beli', 'pulsa', 'listrik', 'lwt', 'mbangkingmakanya', 'ayoo', 'isi', 'token', 'lwt', 'aplikasi', 'pln', 'mobile']"
5,2022-04-26 12:12:46,dengan adanya aplikasi pln mobalesemua terasa mudah dan aplikasi y juga mudah di mengertitrimakasi pln mobile pln jaya slalu,"['aplikasi', 'pln', 'mobalesemua', 'mudah', 'aplikasi', 'y', 'mudah', 'mengertitrimakasi', 'pln', 'mobile', 'pln', 'jaya', 'slalu']"
1,2022-04-26 11:05:18,ini aplikasi lemot banget responnya untuk pengaduan gangguannnya terlalu berbelit belit dan lama banget kasih solusi ujungujungnya tetep telpon dah ke pusat centernya hadeeewh sangat mengecewakan sekali mohon ditingkatkan lagi untuk pelayanan pengaduan gangguannnya baik via aplikasi atau via call centernya terimakasih,"['aplikasi', 'lot', 'banget', 'responnya', 'adu', 'gangguannnya', 'belit', 'belit', 'banget', 'kasih', 'solusi', 'ujungujungnya', 'tetep', 'telpon', 'dah', 'pusat', 'centernya', 'hadeeewh', 'kecewa', 'mohon', 'tingkat', 'layan', 'adu', 'gangguannnya', 'via', 'aplikasi', 'via', 'call', 'centernya', 'terimakasih']"
2,2022-04-26 09:53:14,setiap mau ambil foto waktu kendala tulisan periksa balik terus ke home mohon diperbaiki supaya tidak perlu diulangi lagi,"['ambil', 'foto', 'kendala', 'tulis', 'periksa', 'home', 'mohon', 'baik', 'ulang']"
5,2022-04-26 09:50:44,aplikasi ini sangat terasa membantu sekali saat ada permasalahan atau urusan dengan jaringan kelistrikan di rumah saya tinggal sentuh layar handphone ga lama petugas datang jadi ga perlu repot telpon udah setara dengan aplikasi ojol yg kini banyak digunakan masyarakat terobosan keren pln,"['aplikasi', 'bantu', 'masalah', 'urus', 'jaring', 'listrik', 'rumah', 'tinggal', 'sentuh', 'layar', 'handphone', 'ga', 'tugas', 'ga', 'repot', 'telpon', 'udah', 'tara', 'aplikasi', 'ojol', 'yg', 'masyarakat', 'terobos', 'keren', 'pln']"
5,2022-04-26 09:29:55,sangat membantu bagi pelanggan yang jauh dengan aplikasi pln mobile ini  semoga aplikasi ini semakin mudah digunakan dan bisa berkomunikasi dengan baik sukses selalu pln,"['bantu', 'langgan', 'aplikasi', 'pln', 'mobile', 'moga', 'aplikasi', 'mudah', 'komunikasi', 'sukses', 'pln']"
4,2022-04-26 08:22:28,min mau tambah daya tapi selalu ada peringatan untuk selesaikan permohonan yg lain padahal belum bikin permohonan apa pun krna baru aktivasi akun juga mohon bantuannya min,"['min', 'daya', 'ingat', 'selesai', 'mohon', 'yg', 'bikin', 'mohon', 'krna', 'aktivasi', 'akun', 'mohon', 'bantu', 'min']"
5,2022-04-26 08:10:30,akhir akhir ini selama bulan maret  ko aplikasi agak lambat y respon nya ketika mengoperasikan aplikasi nya agak lambat loading nya semoga apikasi pln mobile bisa lebih baik lagi,"['maret', 'ko', 'aplikasi', 'lambat', 'y', 'respon', 'nya', 'operasi', 'aplikasi', 'nya', 'lambat', 'loading', 'nya', 'moga', 'apikasi', 'pln', 'mobile']"
4,2022-04-26 06:43:39,sblmnya petugas pencatat meter yg ketuk pagar itupun jika ada org dirumah dan mendengar ketukan dipagar tentu dibuka sering kali tdk mendengar ketukan shg tdk ada catatan meter yg sesungguhnya maka akibatnya tagihan akan dipukul rata pemakaian nya oleh pln terimakasih pln ada pln mobile swacam namun saya sering kali lupa utk ambil foto dgn swacam sering dan dari seminggu lalu mulai meng active kan alarm di laptop setiap tgl  setiap bulan terimakasih pln salamcipie,"['sblmnya', 'tugas', 'catat', 'meter', 'yg', 'ketuk', 'pagar', 'itu', 'org', 'rumah', 'dengar', 'ketu', 'pagar', 'buka', 'kali', 'tdk', 'dengar', 'ketu', 'shg', 'tdk', 'catat', 'meter', 'yg', 'sungguh', 'akibat', 'tagih', 'pukul', 'pakai', 'nya', 'pln', 'terimakasih', 'pln', 'pln', 'mobile', 'swacam', 'kali', 'lupa', 'utk', 'ambil', 'foto', 'dgn', 'swacam', 'minggu', 'meng', 'active', 'alarm', 'laptop', 'tgl', 'terimakasih', 'pln', 'salamcipie']"
5,2022-04-26 06:34:52,berguna bangetsempet panik karna listrik tibatiba padamtapi setelah make aplikasi inibeneran dong respon cepet asal apa yg kita ajuin benermantap bgt pln mobile thanks,"['guna', 'bangetsempet', 'panik', 'karna', 'listrik', 'tibatiba', 'padamtapi', 'make', 'aplikasi', 'inibeneran', 'respon', 'cepet', 'yg', 'ajuin', 'benermantap', 'bgt', 'pln', 'mobile', 'thanks']"
5,2022-04-25 21:56:05,pengajuan proses penambahan daya menjadi lebih mudah pengisian ulang token jg makin mudah banyak alternatif proses pembayaran info pemadaman jg update,"['aju', 'proses', 'tambah', 'daya', 'mudah', 'isi', 'ulang', 'token', 'jg', 'mudah', 'alternatif', 'proses', 'bayar', 'info', 'madam', 'jg', 'update']"
5,2022-04-25 20:25:18,aplikasinya sangat bermanfaatpengaduan saya mengenai terjadinya mati listrik beberapa rumah di kompleks sayaada beberapa yang hidupsaya hub call centrepengaduan saya di respondan saya bisa memantau proses pengerjaan melalui aplikasi inidan saya dihubungi oleh ranting terdekatcall center dan aplikasi ini sangat b ermanfaatterima kasih,"['aplikasi', 'bermanfaatpengaduan', 'mati', 'listrik', 'rumah', 'kompleks', 'sayaada', 'hidupsaya', 'hub', 'call', 'centrepengaduan', 'respondan', 'pantau', 'proses', 'kerja', 'aplikasi', 'inidan', 'hubung', 'ranting', 'terdekatcall', 'center', 'aplikasi', 'b', 'ermanfaatterima', 'kasih']"
5,2022-04-25 20:14:28,wooowww pln mobile semakin didepan semakin memudahkan cukup kutak katik hp gak perlu keluar rumah dan yang penting gak ribet gak punya aplikasi pln mobile gak keren lohh balik ajah kejaman batu,"['wooowww', 'pln', 'mobile', 'depan', 'mudah', 'kutak', 'katik', 'hp', 'gak', 'rumah', 'gak', 'ribet', 'gak', 'aplikasi', 'pln', 'mobile', 'gak', 'keren', 'lohh', 'ajah', 'kejam', 'batu']"
5,2022-04-25 19:36:43,terima kasih pln dengan adanya aplikasi ini sangat membantu dan memudahkan saya baik dalam laporan gangguan maupun penanganan gangguanya serta pembayaran rekening listrik terus maju pln,"['terima', 'kasih', 'pln', 'aplikasi', 'bantu', 'mudah', 'lapor', 'ganggu', 'tangan', 'gangguanya', 'bayar', 'rekening', 'listrik', 'maju', 'pln']"
1,2022-04-25 17:26:52,pembelian token rb pada tanggal  april di apps ini status lunas tapi nomer token tidak dikirim terpaksa kontak  untuk meminta nomer tokennya mohon diperbaiki sistem anda sudah uninstall dan install apps  kali tetap tidak ada nomer tokennya dan memakai menu bantuan chat untuk meminta nomer token,"['beli', 'token', 'rb', 'tanggal', 'april', 'apps', 'status', 'lunas', 'nomer', 'token', 'kirim', 'paksa', 'kontak', 'nomer', 'tokennya', 'mohon', 'baik', 'sistem', 'uninstall', 'install', 'apps', 'kali', 'nomer', 'tokennya', 'pakai', 'menu', 'bantu', 'chat', 'nomer', 'token']"
5,2022-04-25 16:21:48,sangat praktis dan bermanfaat sudah bisa beli pulsa cepat dalam melapor pengaduan maupun pasang baru dan penambahan daya sudah banyak kemajuan dari versi sebelumnya tks,"['praktis', 'manfaat', 'beli', 'pulsa', 'cepat', 'lapor', 'adu', 'pasang', 'tambah', 'daya', 'maju', 'versi', 'tks']"
5,2022-04-25 15:15:39,aplikasi lemotmau naik daya dsuruh blanja rbga tau redeemed kupon naik dayanya dimanamau plih menu naik dayakecamatan dan kelurahan jg g tersedia sesuai plihanmuter trus lemot bgt,"['aplikasi', 'lemotmau', 'daya', 'dsuruh', 'blanja', 'rbga', 'tau', 'redeemed', 'kupon', 'daya', 'dimanamau', 'plih', 'menu', 'dayakecamatan', 'lurah', 'jg', 'g', 'sedia', 'sesuai', 'plihanmuter', 'trus', 'lot', 'bgt']"
5,2022-04-25 14:44:22,super aplikasi feature lengkap dan sangat membantu bgt dalam pelaporan gangguan dan transaksi lainnya semua jadi lebih mudah dlm  genggaman tanpa harus ke pln,"['super', 'aplikasi', 'feature', 'lengkap', 'bantu', 'bgt', 'lapor', 'ganggu', 'transaksi', 'mudah', 'dlm', 'genggam', 'pln']"
5,2022-04-25 14:17:43,tenang aja baru adaptasi aplikasi pln mobile  terus maju sambil berinovasi kreatif dan cerdas dalam mengoptimalkan dengan cara yang sederhana tentunya bisa berdampak pada pengeperasional hm saya mendukung dengan energi bersih ramah lingkungan kedepannya,"['tenang', 'aja', 'adaptasi', 'aplikasi', 'pln', 'mobile', 'maju', 'inovasi', 'kreatif', 'cerdas', 'optimal', 'sederhana', 'dampak', 'rasional', 'hm', 'dukung', 'energi', 'bersih', 'ramah', 'lingkung', 'depan']"
5,2022-04-25 13:48:12,respon pasang baru sangat cepat melalui aplikasi pln mobile  kerennn segala kebutuhan listrik bisa di akomodir lewat aplikasi ini sukses selalu pln,"['respon', 'pasang', 'cepat', 'aplikasi', 'pln', 'mobile', 'kerennn', 'butuh', 'listrik', 'akomodir', 'aplikasi', 'sukses', 'pln']"
5,2022-04-25 13:11:46,kondisi terkini selalu di update yah dan pengalaman customer experiencenya pun baik kok aplikasi jg mudah digunakan,"['kondisi', 'kini', 'update', 'yah', 'alam', 'customer', 'experiencenya', 'aplikasi', 'jg', 'mudah']"
5,2022-04-25 13:10:50,bebrapa fitur belum bisa diakses misalnya grafik pemakaian  apabila memiliki  nomor rekening atau lebih detil informasi hanya dapat menampilkan  nomor rekening  titik wilayahtitik lokasi tidak sesuai aktual anyway tambahan hari ini selass  mei  sudah daftar utk tambah daya notif saya terima progres dapat dilihat pada menu status permohonan dan ternyata menu dimaksud tidak ada sudah konfirm ke  jadi bunyi notif cenderung menyesatkan,"['bebrapa', 'fitur', 'akses', 'grafik', 'pakai', 'milik', 'nomor', 'rekening', 'detil', 'informasi', 'tampil', 'nomor', 'rekening', 'titik', 'wilayahtitik', 'lokasi', 'sesuai', 'aktual', 'anyway', 'tambah', 'selass', 'mei', 'daftar', 'utk', 'daya', 'notif', 'terima', 'progres', 'menu', 'status', 'mohon', 'menu', 'konfirm', 'bunyi', 'notif', 'cenderung', 'sesat']"
5,2022-04-25 12:54:55,aplikasi pln mobile bikin mudah bagi pelanggan dalam meng akses informasi serta melakukan berbagai keperluan terkait listrik efekrif dan efisien bagi pelanggan tidak perlu lagi harus keluar rumah  apalagi sekarang masih pandemi covid kita bisa menghidari penyebaranya pln luar biasa dengan terobosannyapln memang terbaik,"['aplikasi', 'pln', 'mobile', 'bikin', 'mudah', 'langgan', 'meng', 'akses', 'informasi', 'perlu', 'kait', 'listrik', 'efekrif', 'efisien', 'langgan', 'rumah', 'pandemi', 'covid', 'menghidari', 'bara', 'pln', 'terobosannyapln', 'baik']"
5,2022-04-25 12:51:47,pelayanannya bagussetiap kali pengaduan gangguan jaringan  ada pemadaman cepat di tanggapi dan di atasitrima kasih aplikasinya sangat membantu,"['layan', 'bagussetiap', 'kali', 'adu', 'ganggu', 'jaring', 'madam', 'cepat', 'tanggap', 'atasitrima', 'kasih', 'aplikasi', 'bantu']"
1,2022-04-25 10:20:59,ribet minta migrasi tapi menu yang tersedia tambah daya dan migrasi siapaaaaa juga yang mau tambah daya terus pembayaran tidak bisa pakai offline gimana orang tua yang nggak punya ewallet ataupun internet banking,"['ribet', 'migrasi', 'menu', 'sedia', 'daya', 'migrasi', 'siapaaaaa', 'daya', 'bayar', 'pakai', 'offline', 'gimana', 'orang', 'tua', 'nggak', 'ewallet', 'internet', 'banking']"
5,2022-04-25 10:11:16,mantap terasa lebih dekat dan mudah kontrolbelilaporan gangguan jd lebih mudah dan cepattingkatkan terus plnbravo,"['mantap', 'mudah', 'kontrolbelilaporan', 'ganggu', 'jd', 'mudah', 'cepattingkatkan', 'plnbravo']"
5,2022-04-25 09:53:58,semua semakin mudah dan gampang hanya cukup mendownload aplikasi ini sy bisa mengecek pemakaian listrik saya dan pengaduan klo ada masalah listrik di rumah saya dan sekarang sdh bisa tambah daya dan pasang baru kwh bisa lewat aplikasi ini smoga pln bisa memberikan yg terbaik buat pemakai listrik nya,"['mudah', 'gampang', 'mendownload', 'aplikasi', 'sy', 'ecek', 'pakai', 'listrik', 'adu', 'klo', 'listrik', 'rumah', 'sdh', 'daya', 'pasang', 'kwh', 'aplikasi', 'smoga', 'pln', 'yg', 'baik', 'pakai', 'listrik', 'nya']"
5,2022-04-25 09:43:53,aplikasi yang sangat membantu dan banyak fiturnya jadi tidak repot lagi kalau ada gangguan listrik tinggal lapor di aplikasi dan responya cepat,"['aplikasi', 'bantu', 'fiturnya', 'repot', 'ganggu', 'listrik', 'tinggal', 'lapor', 'aplikasi', 'responya', 'cepat']"
5,2022-04-25 09:32:24,aplikasi ini sangat membantu bangetapalagi kalo ada gangguan mati lampu ditambah lg sekarang ada market place nyajozzz pln mobile,"['aplikasi', 'bantu', 'bangetapalagi', 'kalo', 'ganggu', 'mati', 'lampu', 'tambah', 'lg', 'market', 'place', 'nyajozzz', 'pln', 'mobile']"
5,2022-04-25 08:53:04,sejak pakai aplikasi ini pelayanan pln jadi semakin baik untuk perbaikan aplikasinya disempurnakan lagi karena masih sering error terimakasih sukses selalu untuk pln,"['pakai', 'aplikasi', 'layan', 'pln', 'baik', 'aplikasi', 'sempurna', 'error', 'terimakasih', 'sukses', 'pln']"
5,2022-04-25 08:48:24,aplikasi yg sangat membantu mudah penggunaannya cukup lewat aplikasi ini kita sdh bisa bertransaksi dan melaporkan kejadian gangguan tidak perlu ke kantor pln dan bisa monitor lewat aplikasi pln mobile,"['aplikasi', 'yg', 'bantu', 'mudah', 'guna', 'aplikasi', 'sdh', 'transaksi', 'lapor', 'jadi', 'ganggu', 'kantor', 'pln', 'monitor', 'aplikasi', 'pln', 'mobile']"
5,2022-04-25 08:38:15,aplikasi ini sangat membantu sekali sekarang g perlu lagy buang pulsa untuk laporan gangguan g perlu lagy dateng ke kantor pln kalo mau proses pasang kwh tambah daya semua jadi simple dan mudah pake aplikasi ini terimakasih pln,"['aplikasi', 'bantu', 'g', 'lagy', 'buang', 'pulsa', 'lapor', 'ganggu', 'g', 'lagy', 'dateng', 'kantor', 'pln', 'kalo', 'proses', 'pasang', 'kwh', 'daya', 'simple', 'mudah', 'pake', 'aplikasi', 'terimakasih', 'pln']"
5,2022-04-25 08:35:35,pelaporan gangguan dan permohonan tambah daya jadi mudah dengan aplikasi pln mobile informasi gangguan di sekitar lokasi kita juga ditampilkan aplikasi yang membantu,"['lapor', 'ganggu', 'mohon', 'daya', 'mudah', 'aplikasi', 'pln', 'mobile', 'informasi', 'ganggu', 'lokasi', 'tampil', 'aplikasi', 'bantu']"
5,2022-04-25 08:02:01,langsung saya kasih bintang  karna dengan adaya aplikasi ini apapun langsung jd mudah  nyesel yang gak instal aplikasi ini karna sngat membantu sekali,"['langsung', 'kasih', 'bintang', 'karna', 'adaya', 'aplikasi', 'apa', 'langsung', 'jd', 'mudah', 'nyesel', 'gak', 'instal', 'aplikasi', 'karna', 'sngat', 'bantu']"
